{
  "events": [
    {
      "audio_event_time": 999.999935098835,
      "audio_level_dbfs": -11.952755099438619,
      "audio_quality": "good",
      "av_offset_ms": -6.490116504664911e-05,
      "clipped": false,
      "correlation": 0.9941379451749073,
      "deviation_ms": -6.490116504664911e-05,
      "event_id": "EVT-000001",
      "expected_av_offset_ms": 0.0,
      "flags": [],
      "grade": "pass",
      "graded_on": "offset",
      "mode": "FILE",
      "reference": {
        "accuracy_ns": "unknown",
        "domain": "",
        "sync_state": "unknown",
        "type": "file"
      },
      "schema": "mxl-avsync-event-log/1",
      "seq": 1,
      "test_id": "TEST-2160p50_hevc_aac_sync",
      "uncertainty_ms": 0.05,
      "video_event_time": 1000.0,
      "video_quality": "good"
    },
    {
      "audio_event_time": 1499.9999353414817,
      "audio_level_dbfs": -11.939000932745191,
      "audio_quality": "good",
      "av_offset_ms": -6.465851834036584e-05,
      "clipped": false,
      "correlation": 0.9965683182132341,
      "deviation_ms": -6.465851834036584e-05,
      "event_id": "EVT-000002",
      "expected_av_offset_ms": 0.0,
      "flags": [],
      "grade": "pass",
      "graded_on": "offset",
      "mode": "FILE",
      "reference": {
        "accuracy_ns": "unknown",
        "domain": "",
        "sync_state": "unknown",
        "type": "file"
      },
      "schema": "mxl-avsync-event-log/1",
      "seq": 2,
      "test_id": "TEST-2160p50_hevc_aac_sync",
      "uncertainty_ms": 0.05,
      "video_event_time": 1500.0,
      "video_quality": "good"
    },
    {
      "audio_event_time": 2000.0001180377574,
      "audio_level_dbfs": -11.863034833819935,
      "audio_quality": "good",
      "av_offset_ms": 0.00011803775737462274,
      "clipped": false,
      "correlation": 0.9917070134603415,
      "deviation_ms": 0.00011803775737462274,
      "event_id": "EVT-000003",
      "expected_av_offset_ms": 0.0,
      "flags": [],
      "grade": "pass",
      "graded_on": "offset",
      "mode": "FILE",
      "reference": {
        "accuracy_ns": "unknown",
        "domain": "",
        "sync_state": "unknown",
        "type": "file"
      },
      "schema": "mxl-avsync-event-log/1",
      "seq": 3,
      "test_id": "TEST-2160p50_hevc_aac_sync",
      "uncertainty_ms": 0.05,
      "video_event_time": 2000.0,
      "video_quality": "good"
    },
    {
      "audio_event_time": 2500.000036911605,
      "audio_level_dbfs": -11.971298779617896,
      "audio_quality": "good",
      "av_offset_ms": 3.691160509333713e-05,
      "clipped": false,
      "correlation": 0.9941133961804505,
      "deviation_ms": 3.691160509333713e-05,
      "event_id": "EVT-000004",
      "expected_av_offset_ms": 0.0,
      "flags": [],
      "grade": "pass",
      "graded_on": "offset",
      "mode": "FILE",
      "reference": {
        "accuracy_ns": "unknown",
        "domain": "",
        "sync_state": "unknown",
        "type": "file"
      },
      "schema": "mxl-avsync-event-log/1",
      "seq": 4,
      "test_id": "TEST-2160p50_hevc_aac_sync",
      "uncertainty_ms": 0.05,
      "video_event_time": 2500.0,
      "video_quality": "good"
    },
    {
      "audio_event_time": 3000.000019236092,
      "audio_level_dbfs": -11.973356383367742,
      "audio_quality": "good",
      "av_offset_ms": 1.9236092157370877e-05,
      "clipped": false,
      "correlation": 0.9940923037901122,
      "deviation_ms": 1.9236092157370877e-05,
      "event_id": "EVT-000005",
      "expected_av_offset_ms": 0.0,
      "flags": [],
      "grade": "pass",
      "graded_on": "offset",
      "mode": "FILE",
      "reference": {
        "accuracy_ns": "unknown",
        "domain": "",
        "sync_state": "unknown",
        "type": "file"
      },
      "schema": "mxl-avsync-event-log/1",
      "seq": 5,
      "test_id": "TEST-2160p50_hevc_aac_sync",
      "uncertainty_ms": 0.05,
      "video_event_time": 3000.0,
      "video_quality": "good"
    },
    {
      "audio_event_time": 3500.000040781419,
      "audio_level_dbfs": -11.95366427660362,
      "audio_quality": "good",
      "av_offset_ms": 4.078141910213162e-05,
      "clipped": false,
      "correlation": 0.996568371447373,
      "deviation_ms": 4.078141910213162e-05,
      "event_id": "EVT-000006",
      "expected_av_offset_ms": 0.0,
      "flags": [],
      "grade": "pass",
      "graded_on": "offset",
      "mode": "FILE",
      "reference": {
        "accuracy_ns": "unknown",
        "domain": "",
        "sync_state": "unknown",
        "type": "file"
      },
      "schema": "mxl-avsync-event-log/1",
      "seq": 6,
      "test_id": "TEST-2160p50_hevc_aac_sync",
      "uncertainty_ms": 0.05,
      "video_event_time": 3500.0,
      "video_quality": "good"
    },
    {
      "audio_event_time": 4000.00004558749,
      "audio_level_dbfs": -11.98252033230602,
      "audio_quality": "good",
      "av_offset_ms": 4.558749014904606e-05,
      "clipped": false,
      "correlation": 0.9916910131783471,
      "deviation_ms": 4.558749014904606e-05,
      "event_id": "EVT-000007",
      "expected_av_offset_ms": 0.0,
      "flags": [],
      "grade": "pass",
      "graded_on": "offset",
      "mode": "FILE",
      "reference": {
        "accuracy_ns": "unknown",
        "domain": "",
        "sync_state": "unknown",
        "type": "file"
      },
      "schema": "mxl-avsync-event-log/1",
      "seq": 7,
      "test_id": "TEST-2160p50_hevc_aac_sync",
      "uncertainty_ms": 0.05,
      "video_event_time": 4000.0,
      "video_quality": "good"
    },
    {
      "audio_event_time": 4500.000001250021,
      "audio_level_dbfs": -11.972542734405724,
      "audio_quality": "good",
      "av_offset_ms": 1.2500213415478356e-06,
      "clipped": false,
      "correlation": 0.9940742003036522,
      "deviation_ms": 1.2500213415478356e-06,
      "event_id": "EVT-000008",
      "expected_av_offset_ms": 0.0,
      "flags": [],
      "grade": "pass",
      "graded_on": "offset",
      "mode": "FILE",
      "reference": {
        "accuracy_ns": "unknown",
        "domain": "",
        "sync_state": "unknown",
        "type": "file"
      },
      "schema": "mxl-avsync-event-log/1",
      "seq": 8,
      "test_id": "TEST-2160p50_hevc_aac_sync",
      "uncertainty_ms": 0.05,
      "video_event_time": 4500.0,
      "video_quality": "good"
    },
    {
      "audio_event_time": 5000.000024031262,
      "audio_level_dbfs": -11.964388881251217,
      "audio_quality": "good",
      "av_offset_ms": 2.4031262000789866e-05,
      "clipped": false,
      "correlation": 0.9940974352245804,
      "deviation_ms": 2.4031262000789866e-05,
      "event_id": "EVT-000009",
      "expected_av_offset_ms": 0.0,
      "flags": [],
      "grade": "pass",
      "graded_on": "offset",
      "mode": "FILE",
      "reference": {
        "accuracy_ns": "unknown",
        "domain": "",
        "sync_state": "unknown",
        "type": "file"
      },
      "schema": "mxl-avsync-event-log/1",
      "seq": 9,
      "test_id": "TEST-2160p50_hevc_aac_sync",
      "uncertainty_ms": 0.05,
      "video_event_time": 5000.0,
      "video_quality": "good"
    },
    {
      "audio_event_time": 5500.000036480737,
      "audio_level_dbfs": -11.955319899964929,
      "audio_quality": "good",
      "av_offset_ms": 3.6480737435340416e-05,
      "clipped": false,
      "correlation": 0.9965655379547771,
      "deviation_ms": 3.6480737435340416e-05,
      "event_id": "EVT-000010",
      "expected_av_offset_ms": 0.0,
      "flags": [],
      "grade": "pass",
      "graded_on": "offset",
      "mode": "FILE",
      "reference": {
        "accuracy_ns": "unknown",
        "domain": "",
        "sync_state": "unknown",
        "type": "file"
      },
      "schema": "mxl-avsync-event-log/1",
      "seq": 10,
      "test_id": "TEST-2160p50_hevc_aac_sync",
      "uncertainty_ms": 0.05,
      "video_event_time": 5500.0,
      "video_quality": "good"
    }
  ],
  "graded_on": "offset",
  "mode": "FILE",
  "reference": {
    "accuracy_ns": "unknown",
    "domain": "",
    "sync_state": "unknown",
    "type": "file"
  },
  "schema": "mxl-avsync-result/1",
  "statistics": {
    "audio_latency": {
      "discarded": 0,
      "dropout_seqs": [],
      "excluding_outliers": {
        "max": null,
        "mean": null,
        "median": null,
        "min": null,
        "stddev": null
      },
      "max": null,
      "mean": null,
      "median": null,
      "min": null,
      "outlier_seqs": [],
      "p5": null,
      "p5_status": "insufficient_samples",
      "p95": null,
      "p95_status": "insufficient_samples",
      "p99": null,
      "p99_status": "insufficient_samples",
      "reasons": {},
      "series": [],
      "stddev": null,
      "valid": 0
    },
    "deviation": {
      "discarded": 0,
      "dropout_seqs": [],
      "excluding_outliers": {
        "max": 4.558749014904606e-05,
        "mean": 2.9182661039937686e-05,
        "median": 3.6480737435340416e-05,
        "min": 1.2500213415478356e-06,
        "stddev": 1.425458125383012e-05
      },
      "max": 0.00011803775737462274,
      "mean": 1.927567012671716e-05,
      "median": 3.025599971806514e-05,
      "min": -6.490116504664911e-05,
      "outlier_seqs": [
        1,
        2,
        3
      ],
      "p5": null,
      "p5_status": "insufficient_samples",
      "p95": null,
      "p95_status": "insufficient_samples",
      "p99": null,
      "p99_status": "insufficient_samples",
      "reasons": {},
      "series": [
        -6.490116504664911e-05,
        -6.465851834036584e-05,
        0.00011803775737462274,
        3.691160509333713e-05,
        1.9236092157370877e-05,
        4.078141910213162e-05,
        4.558749014904606e-05,
        1.2500213415478356e-06,
        2.4031262000789866e-05,
        3.6480737435340416e-05
      ],
      "stddev": 5.098433910597602e-05,
      "valid": 10
    },
    "video_latency": {
      "discarded": 0,
      "dropout_seqs": [],